{
  "$schema": "https://raw.githubusercontent.com/TSM-061/ctOS/main/schema/greeter.schema.json",
  "user": "aoeu",
  "monitor": "eDP-1",
  "fontFamily": "Terminus",
  "fakeIdentity": {
    "id": "XYZ-843",
    "class": "L5_PROV",
    "fullName": "Blume Admin"
  },
  "fakeStatus": {
    "env": "Workstation",
    "node": "109.389.013.301"
  },
  "modes": {
    "greetd": {
      "animations": "all",
      "exit": ["pkill", "Hyprland"],
      "launch": ["Hyprland"]
    },
    "lockd": {
      "animations": "reduced"
    },
    "test": {
      "animations": "all"
    }
  }
}
